paper_id,title,first_author,authors,norm_title,norm_first_author
4de80880c1677245f8a12fd969b4cc2d,"Evidence of the effects of ESG (environmental, social, and governance) and rental availability on business value (analysis of businesses in the banking sector of the London Stock Exchange's FTSE100 from 2020 to 2024)",Adel Necib,Adel Necib; Anis Jarboui,evidence of the effects of esg environmental social and governance and rental availability on business value analysis of businesses in the banking sector of the london stock exchanges ftse100 from 2020 to 2024,adel necib
88a4c46c145fa4fc171d577c654b3034,Evidencing Uncertain Career Paths Among Overqualified Employees,Gonzague Isirabahenda,Gonzague Isirabahenda,evidencing uncertain career paths among overqualified employees,gonzague isirabahenda
bbdd60a1fb2fd3e70dcd19788a942b10,Evolving Private Information: A Stochastic Extension of Informational Asymmetry Models,Darius Hanson,Darius Hanson,evolving private information a stochastic extension of informational asymmetry models,darius hanson
6bc379dffc7f7af9a7152dd5bdcc7ccd,Executive Compensation Sensitivity and Green Performance: Evidence from China,Yuxin REN,Yuxin REN,executive compensation sensitivity and green performance evidence from china,yuxin ren
4f1648a5c69e130c7adf34e99bc8c84a,Exit Incentives for Carbon Emissive Firms,René Aïd,René Aïd; Xiangying Pang; Xiaolu Tan; Directors,exit incentives for carbon emissive firms,rene aid
0183b1ecd499ed9e58ca8c2417de5f42,Exploring Ethical Dilemmas and their Impact on Decision-Making in Managerial Accounting,Ritwika Bhattacharyya,Ritwika Bhattacharyya; Kaustav Nag; Swarnendu Das,exploring ethical dilemmas and their impact on decisionmaking in managerial accounting,ritwika bhattacharyya
2d187a439264020536a059b82c66f8ad,"Exploring the Impact of Sustainability ""Tweets"" Attributes on Abnormal Returns",Zhenjia Yang,Zhenjia Yang; John Quigley; Tang Leilei; Amr ElAlfy,exploring the impact of sustainability tweets attributes on abnormal returns,zhenjia yang
c74481f8939a02a16a38fe4c45bb548e,Face-to-Face Board Meetings and Board Effectiveness in M&A Decisions,Shuning Jiang,Shuning Jiang; Yanting (Crystal) Shi; Kun Wang,facetoface board meetings and board effectiveness in ma decisions,shuning jiang
dafe821820d6e2937e4cfbe0b8e9f6ae,"Financial Literacy, Risk Tolerance, and Portfolio Choice: Evidence from Portuguese Investors",Raquel M. Gaspar,Raquel M. Gaspar; Inês Rico Lopes; Compensation,financial literacy risk tolerance and portfolio choice evidence from portuguese investors,raquel gaspar
84050f06a6a8a3f5b68f596921a7cd0d,Financing Europe's Transition to a Low-Carbon Economy: The Role of Sustainable Finance,Chiara Pappalardo,Chiara Pappalardo,financing europes transition to a lowcarbon economy the role of sustainable finance,chiara pappalardo
7668e175f4ec138008b9b95bf5921247,"Firm's  < Corporate <  Governance, Capital Structure Flexibility, and Bank Capital",Yakshup Chopra,Yakshup Chopra,firms   corporate   governance capital structure flexibility and bank capital,yakshup chopra
34c23b33253d56c9e8571380edea1cff,Firm-Level Political Risk and Accounting Conservatism: Evidence from Earnings Conference Calls,Safa Gaaya,Safa Gaaya; Moez Essid; Adel Beldi; Itidel Ben Saad,firmlevel political risk and accounting conservatism evidence from earnings conference calls,safa gaaya
9de1e98157699dcd88044661286fd674,Firm-level Geopolitical Risk,Xuan Zhou,Xuan Zhou,firmlevel geopolitical risk,xuan zhou
f9573fff5de9ef2690a91ba3728a9ac9,Fixed Capital and Growth Imperatives: Is Commercial Aviation Trapped in a Treadmill?,Henri Chevalier,Henri Chevalier; Eric Pineault; Institutional Investors,fixed capital and growth imperatives is commercial aviation trapped in a treadmill,henri chevalier
35a6ea766c91f59bcd0d0cc1730f7d43,Fostering Environmental Integrity via Investor-Focused Communications: Private In-House Meeting Disclosures and Greenwashing Behaviors,June Cao,June Cao; Zijie Huang; Ahmad Usman Shahid,fostering environmental integrity via investorfocused communications private inhouse meeting disclosures and greenwashing behaviors,june cao
82663eb4fa83df4f02c3bbb2d5ca2c40,From Agency Theory to Integrity: The evolution of Michael C. Jensen's thought,Sinclair Davidson,Sinclair Davidson,from agency theory to integrity the evolution of michael c jensens thought,sinclair davidson
338a4bc7aa87b19a470cbef61c3d57ff,From Banks to Nonbanks,Bruno Albuquerque,Bruno Albuquerque; Eugenio Cerutti; Nanyu Chen; Melih Firat,from banks to nonbanks,bruno albuquerque
6d29d904373db30519f19fb536a59d73,From Black Box to Open Book: An Emerging Transparency Imperative in Generative Ai Codebases,Eleanor Adele Watson,Eleanor Adele Watson; Matt van Italie,from black box to open book an emerging transparency imperative in generative ai codebases,eleanor watson
1b4256b16067309bf1f8a350289d3575,"From Digital to Sustainable: Unveiling the Complex Interactions Between Cryptocurrencies, Traditional Markets and Sustainable Finance in India",Vansh Bathla,Vansh Bathla; Karam Pal Narwal,from digital to sustainable unveiling the complex interactions between cryptocurrencies traditional markets and sustainable finance in india,vansh bathla
69e6e46f810571ef32b9dfc709e7a0f2,From Kpis to ESG: Addressing Redundancy and Distortions in ESG Scores,Matteo Benuzzi,Matteo Benuzzi; Özge Sahin; Sandra Paterlini,from kpis to esg addressing redundancy and distortions in esg scores,matteo benuzzi
3bfc08df1a180d0b092a3fb8adbd0006,From Public to Internal Capital Markets: The Effects of Affiliated IPOs on Group Firms,Luana Zaccaria,Luana Zaccaria; Simone Narizzano; Francesco Savino; Antonio Scalia,from public to internal capital markets the effects of affiliated ipos on group firms,luana zaccaria
512da90f0d355a7374ff49144f48935e,From The Operator's Chair TM - Quantifying AI Risks: Materiality Framework for Board-level Governance,Angela Michael,Angela Michael,from the operators chair tm  quantifying ai risks materiality framework for boardlevel governance,angela michael
28c07106f76ec5d0d722d54eac4517d4,GPT Adoption and the Impact of Disclosure Policies,Cathy L. Yang,Cathy L. Yang; David Restrepo-Amariles; Leo Allen; Aurore Troussel,gpt adoption and the impact of disclosure policies,cathy yang
d62c4a93db38e20db1aabfaca877dfa6,Game of Votes: The Lifecycle Effects of Tenure Voting,Maria Lucia Passador,Maria Lucia Passador,game of votes the lifecycle effects of tenure voting,maria passador
820c808b9f7a31edb48cabd1b90ccbf7,Gender quotas in bank boards: Evidence from post-communist countries,Urszula Mrzyglod,Urszula Mrzyglod; Joanna Rachuba; Dorota Skala,gender quotas in bank boards evidence from postcommunist countries,urszula mrzyglod
b74d285663c464e495f86339fe21e76a,"Germany: IKB Deutsche Industriebank Emergency Liquidity Program, 2008",Ayodeji George,Ayodeji George; Sophia Alden,germany ikb deutsche industriebank emergency liquidity program 2008,ayodeji george
81ee4e328369f88039372ebf3068f743,Global Financial Governance and Banking Regulation: Redesigning Regulation to Promote Stakeholder Interests,Kern Alexander,Kern Alexander; Corporate,global financial governance and banking regulation redesigning regulation to promote stakeholder interests,kern alexander
beca2eca05646f8b67298b0585bb8118,Global to local: be Vocal for Sustainable Development Global Perspec ves on Localising,Mukund Raj,Mukund Raj,global to local be vocal for sustainable development global perspec ves on localising,mukund raj
24213ba29ab5bd1b3e17b728f8993430,Grasshopper's Optimization Algorithm Based ASFC for Enhancing the Performance of Micro Grids,I.E.S. Naidu,I.E.S. Naidu; Satyanarayana Addala,grasshoppers optimization algorithm based asfc for enhancing the performance of micro grids,i.e.s. naidu
66ab0fdb87388279d758b18f34fc283c,Green HR Practices: An Empirical Study in an Manufacturing Sector,Remo Albinus,Remo Albinus; Clayton Michael Fonceca,green hr practices an empirical study in an manufacturing sector,remo albinus
182e6308836393aa2aa49f89e56514ae,Guidance for the < Securities <  Law Practitioner: An Analysis of Key Exemptions from < Securities <  Act Registration,Marc I. Steinberg,Marc I. Steinberg; Ibrahim Nasir,guidance for the  securities   law practitioner an analysis of key exemptions from  securities   act registration,marc steinberg
e854e2b904aba1e64c8d7e1ac398e6d8,History of a 'Missed Opportunities': Dutch Colonial Legacy and Decolonization of the Maritime Economy in Indonesia,Haryono Rinardi,Haryono Rinardi; Singgih Sulistiyono; Yety Rochwulaningsih; Ismail Ali,history of a missed opportunities dutch colonial legacy and decolonization of the maritime economy in indonesia,haryono rinardi
167ea7707f9fa3486520c2680a371f0a,How Do  < Mutual <   < Funds <  Respond to Salient Pollution Events?,Daniel Chai,Daniel Chai; Özlem Dursun-de Neef; Jin Zhang; Han Zhou,how do   mutual     funds   respond to salient pollution events,daniel chai
a316363d8ac6d5b58778deae09b8e003,How Do Mutual Funds Respond to Salient Pollution Events?,Daniel Chai,Daniel Chai; Özlem Dursun-de Neef; Jin Zhang; Han Zhou,how do mutual funds respond to salient pollution events,daniel chai
72b3186219397976e04314ea03255fb6,How Financial Consulting Can Help Prevent Business Bankruptcy in the U.S.,Ligia De Araujo,Ligia De Araujo,how financial consulting can help prevent business bankruptcy in the us,ligia araujo
d9e42355b0544f48864044c487a60cf9,Hunting for Goodwill in de- < SPAC <  Transactions,Al (Aloke) Ghosh,Al (Aloke) Ghosh; Brian Burnett; Proxy Advisors,hunting for goodwill in de  spac   transactions,al ghosh
427aba0840edecdf63048607857c6aef,IMPACT OF  < CORPORATE <  SOCIAL RESPONSIBILITY ON,Dr. Kishor Bholane,Dr. Kishor Bholane,impact of   corporate   social responsibility on,dr. bholane
7676a7a08076ef3d466a004daed0bd50,Impact of National Culture on Environmental Sustainability Performance,Chitra De Silva Lokuwaduge,Chitra De Silva Lokuwaduge; Keshara De Silva; Charumathi Balakrishnan; HABEEB RAHMAN,impact of national culture on environmental sustainability performance,chitra lokuwaduge
baf92fe1ca47494dea4b3d9b8653e6ba,Impact of Team Learning Orientation and Team Agility on  < Corporate <  GHRM Transformation: The Mediating Role of Digital Leadership,Jun Cui,Jun Cui,impact of team learning orientation and team agility on   corporate   ghrm transformation the mediating role of digital leadership,jun cui
25ba5ff78d5aa178b7c488cc16ffe598,Implementing Tourist Fees on a Populated Tourism Island: Issues and Opportunities for Sustainable Development,Yi-Chen Chen,Yi-Chen Chen; Tony Leong-keat Phuah; Shui-Kai Chang,implementing tourist fees on a populated tourism island issues and opportunities for sustainable development,yi-chen chen
1adcc243209cf28619dae7bb81608e38,Improved Control Strategy for Dc Microgrid with SOC Balance,Yanbo Li,Yanbo Li; Jianglong Guo; Linyi Li; Zhigang Wei; Hao Chen; Jun shuo Chen,improved control strategy for dc microgrid with soc balance,yanbo li
d578f892cd6a35006723c437fa81d21e,In-Situ Anchoring of Cobalt Metal Nanoparticles on Sr1.95fe1.3−Xti0.2coxmo0.5o6−Δ Perovskite Anodes for High - Performance Direct Propane Solid Oxide Fuel Cells,Yuhan Li,Yuhan Li; Chengyi Lu; Rongzheng Ren; Chong Lv; He Chao; Lirong Mou; Wang Sun; Chunming Xu,insitu anchoring of cobalt metal nanoparticles on sr195fe13xti02coxmo05o6δ perovskite anodes for high  performance direct propane solid oxide fuel cells,yuhan li
3b74ba7d4b5ddf92021f50d5411249f9,"Increasing Water Stress in Urban India: Impact of AI, LLMs and High-powered Infrastructures",Mandira Dutta,Mandira Dutta; Mandira Dutta; Nirmalya Shome,increasing water stress in urban india impact of ai llms and highpowered infrastructures,mandira dutta
98fb865925c4190d657739cd0f90a968,Indic Finance: A New Dimension to Environmentally Inclusive & Sustainable Framework,Devendra Jain,Devendra Jain; Sunil S. Poshakwale; Pawan Kumar,indic finance a new dimension to environmentally inclusive  sustainable framework,devendra jain
05b9a1593e75d4d537fc23c09b69ae7e,Innovative Energy Financial Instruments and Corporate Trade Credit Financing: Evidence From China’s Launch of Shanghai Crude Oil Futures,Changchun Pan,Changchun Pan; Yuhang Song; Yuzhe Huang; Long Jin,innovative energy financial instruments and corporate trade credit financing evidence from chinas launch of shanghai crude oil futures,changchun pan
7f0441c1ca922640833804eb37c5d7e5,"Innovative Financial Technologies: Strengthening Compliance, Secure Transactions, and Intelligent Advisory Systems Through AI-Driven Automation and Scalable Data Architectures",Srinivasarao Paleti,Srinivasarao Paleti; Jeevani Singireddy; Abhishek Dodda; Jai Kiran Reddy Burugulla; Kishore Challa,innovative financial technologies strengthening compliance secure transactions and intelligent advisory systems through aidriven automation and scalable data architectures,srinivasarao paleti
3575d896a4eec29b5a3945b1876633a0,Institutional Ownership and Firm Performance,Onipe Adabenege Yahaya,Onipe Adabenege Yahaya,institutional ownership and firm performance,onipe yahaya
3e94dcf1227ee6545a873dc51672cad8,Insurers’ Investment Behaviour and the Coronavirus (Covid-19) Pandemic,Constanze Fay,Constanze Fay; Angelica Ghiselli; There are 2 versions of this paper,insurers investment behaviour and the coronavirus covid19 pandemic,constanze fay
08a06406675837cf5e25b9863a2bd727,Investment Universe-Level Returns to Scale and Active Fund Management,Andreas Ørpetveit,Andreas Ørpetveit,investment universelevel returns to scale and active fund management,andreas ørpetveit
f1b22e2bcca4f9a51e3f088a57b4c34f,Judicial Ethics & Leadership Development Training: A Leadership Study Of The Case Of The Speluncean Explorers,Kendall Gouldthorpe,Kendall Gouldthorpe,judicial ethics  leadership development training a leadership study of the case of the speluncean explorers,kendall gouldthorpe
edcdea9691af9cf4c926b9a11f2b4473,LEVERED BETA: INFLUENCE OF DEBT AND  < CORPORATE <  INCOME TAX ON COMPANY SYSTEMATIC RISK. DISCUSSION ON THE CORRECT ALGEBRAIC EQUATION,Mirko Babanic,Mirko Babanic,levered beta influence of debt and   corporate   income tax on company systematic risk discussion on the correct algebraic equation,mirko babanic
5fad30a4526f8dda5c14999f6bd4ced9,Labor Union and Firm-level Environmental Disclosure: Theory Meets Evidence *,Youan Wang,Youan Wang; Zhiting Wu; Zhige Yu,labor union and firmlevel environmental disclosure theory meets evidence,youan wang
db219491d8e36bd835e53318f0de0a74,Leading Without Crashing: Female Leadership and Stock Price Crash Risk in an Emerging Market,NHA DUC BUI,NHA DUC BUI; Christophe Moussu; Thi Tuyet Nhung Nguyen,leading without crashing female leadership and stock price crash risk in an emerging market,nha bui
01b9ed2f4392825b3f6adf2c9cb1907d,Legal Liability Arising from Information Crimes in UAE Law,Dr.Abdulghani Muthanna,Dr.Abdulghani Muthanna,legal liability arising from information crimes in uae law,dr.abdulghani muthanna
893f45e2a36051053882bc516bb6169b,Legal challenges and ESG due diligence in cross-border Mergers and Acquisitions (M&A) in the US,Mahnoor Ali,Mahnoor Ali; Mujadad Jamil,legal challenges and esg due diligence in crossborder mergers and acquisitions ma in the us,mahnoor ali
2edf2e93f880b04a48950fe5c7d56909,"Lenore Palladino, Good Company: Economic Policy After Shareholder Primacy, University of Chicago Press 2024",Katharine Jackson,Katharine Jackson,lenore palladino good company economic policy after shareholder primacy university of chicago press 2024,katharine jackson
a85b9f0bd4e0225fa9642a3db8421257,License on the Way: The Effects of Expedited Licensure for Migrant Workers,Kihwan Bae,Kihwan Bae,license on the way the effects of expedited licensure for migrant workers,kihwan bae
86974b41d89ff0229666ea0f81742e96,Macroeconomic Asymmetries and Default Risk in Emerging Asia,Arti Omar,Arti Omar,macroeconomic asymmetries and default risk in emerging asia,arti omar
f7104c8d503b950d8770e9d7fadb1127,Making Sure Newly Cautious Shareholders Get the Information They Want,,,making sure newly cautious shareholders get the information they want,
a98008029a36d3abfbfc44837f4f306e,Mal-Practices of  < Corporate <  Governance in Pakistani Financial Institutions: Overview of Panama & Pandora Leaks,Zeeshan Ashraf,Zeeshan Ashraf,malpractices of   corporate   governance in pakistani financial institutions overview of panama  pandora leaks,zeeshan ashraf
e5d9b9a40029f047dcebe1b7c13e818a,Managerial Integrity: The Bridge to Lower Cost of Debt Capital,Mo Yang,Mo Yang; Yifan Meng; Yan Li,managerial integrity the bridge to lower cost of debt capital,mo yang
0bf0172779d217667da9ede5e7e6b385,"Managers See, Analysts Hear. Epistemic Divide in Financial Dialogues",Costanza Maria Lucchini,Costanza Maria Lucchini; Andrea Rocci; Johanna Miecznikowski-Fuenfschilling,managers see analysts hear epistemic divide in financial dialogues,costanza lucchini
460659af255e73a2fe138dbe97692969,Mapping the Landscape of Green Finance and Banking Performance Research: A Bibliometric Analysis,Prajjwol Bikram Khadka,Prajjwol Bikram Khadka; Dipendra Karki; Rewan Kumar Dahal; Dristi Khanal,mapping the landscape of green finance and banking performance research a bibliometric analysis,prajjwol khadka
0fb59a8e029e5c4605cf0cf882c04dfc,Market-Dependent Momentum and < Institutional <  Ownership,Ming Wu,Ming Wu,marketdependent momentum and  institutional   ownership,ming wu
386f38fecd23313230555997fe41c392,Measuring Geopolitical Uncertainty: A Comparative Analysis of Risk Indices in a Fragmented World,Sunando Roy,Sunando Roy,measuring geopolitical uncertainty a comparative analysis of risk indices in a fragmented world,sunando roy
ea4763f5abe1ddda366b542d0ba384f5,Measuring Risk-Adjusted Returns in Alternative Investments:  A Presentation,Hilary Till,Hilary Till,measuring riskadjusted returns in alternative investments  a presentation,hilary till
fe43f3b341163f1d63ea8c3fb52b3955,"Merger Control, Information Leakage and Decision Bias",Salvatore Piccolo,Salvatore Piccolo; Jorge Padilla; Sander Heinsalu; NEil Dryden,merger control information leakage and decision bias,salvatore piccolo
29625bed31738cfe8607e6910e1f0ae5,Micro Foundations of Cooperative Financial Institutions: A Game Theoretical Analysis,Virginia Cecchini Manara,Virginia Cecchini Manara; Lorenzo Sacconi; Giacomo Maino,micro foundations of cooperative financial institutions a game theoretical analysis,virginia manara
4c752f3d55e29acb9fe43f065fd1babf,Migration Restrictions Relaxation and Firm Skill Upgrading: Evidence from the Hukou Reform in China,Mengqi Niu,Mengqi Niu; Min Dai,migration restrictions relaxation and firm skill upgrading evidence from the hukou reform in china,mengqi niu
4e57258a0fa451a4e25c3075d7b15979,More and Better Options: Strengthening Long-Term CEO Succession Planning,,,more and better options strengthening longterm ceo succession planning,
c5c05ecf85804807c9065e0d42a84b78,Motivational and informational financial ratings,Pierre Chaigneau,Pierre Chaigneau; Nicolas Sahuguet,motivational and informational financial ratings,pierre chaigneau
9ec4d85c95f3c0c6510138821a456d4a,Multi-Physics Model-Based Filtering for Joint Estimation of SOC and Core Temperature in Li-Ion Batteries,Jun Zhou,Jun Zhou; Junjie Li; Xing Wu; Tao Liu; Yixin Jiang; Directors,multiphysics modelbased filtering for joint estimation of soc and core temperature in liion batteries,jun zhou
78cd289a7c33b2bdedde4b82c276d4b0,Mutual Fund Governance of Corporate Political Spending: Evidence from Politically Motivated Charitable Giving,Disen Huang Albrecht,Disen Huang Albrecht; Erdong Wang,mutual fund governance of corporate political spending evidence from politically motivated charitable giving,disen albrecht
345532b1ded71391cb733cc4276fc16a,NATURAL CAPITAL ACCOUNTING (NCA),Esmail Tavakolnia,Esmail Tavakolnia,natural capital accounting nca,esmail tavakolnia
492d5be36b7a0dab943eab073f2fdb07,Navigating Accessibility Rights In The Age Of AI With Special Reference To Assistive Technologies -Challenges And Opportunities,Swetketu Das,Swetketu Das,navigating accessibility rights in the age of ai with special reference to assistive technologies challenges and opportunities,swetketu das
31ed023f87f69061d8ae00252157cad1,Navigating Tax Transparency: Challenges and Opportunities for Trust Building,Kuan Hua Phua,Kuan Hua Phua,navigating tax transparency challenges and opportunities for trust building,kuan phua
208493fe96261f7469011204c20f9fd5,Navigating the Maze: Regulatory Fragmentation and Cost of Bank Debt,Mong Shan Ee,Mong Shan Ee,navigating the maze regulatory fragmentation and cost of bank debt,mong ee
69ee45db8b272d21f14dda7e5683c0e9,Navigating the Uncertainty: How Do Interest Rate Fluctuations Affect ESG Performance?,Çiğdem Vural Yavaş,Çiğdem Vural Yavaş; Seda Bilyay-Erdogan,navigating the uncertainty how do interest rate fluctuations affect esg performance,cigdem yavas
776be67322345187c458e99e7e9769d2,Ngo Activism: Exposure vs. Influence,Michele Fioretti,Michele Fioretti; Victor Saint-Jean; Simon Smith,ngo activism exposure vs influence,michele fioretti
0941234f294669596366522362b46d87,Nonfinancial Disclosure Mandates and Private Lending,Zhaoran Gong,Zhaoran Gong; Zhehao Jia; Donghui Li; SPAC; Fiduciary,nonfinancial disclosure mandates and private lending,zhaoran gong
247427ef075d1541ea2d7f6d6cbdca7a,"Redefining Financial Risk Strategies: The Integration of Smart Automation, Secure Access Systems, and Predictive Intelligence in Insurance, Lending, and Asset Management",Avinash Pamisetty,Avinash Pamisetty; BALAJI ADUSUPALLI; Someshwar Mashetty; pallav Kaulwar; Sneha singreddy,redefining financial risk strategies the integration of smart automation secure access systems and predictive intelligence in insurance lending and asset management,avinash pamisetty
202385ec8cae858a37d216defec7095b,"Redefining Tax Strategies for Multinational Enterprises: Navigating Transparency, Compliance, and Ethical Imperatives in a Changing Global Landscape",Kuan Hua Phua,Kuan Hua Phua,redefining tax strategies for multinational enterprises navigating transparency compliance and ethical imperatives in a changing global landscape,kuan phua
e6f7326a23e33da66b6da7aa39b84334,Regulating Space Cybersecurity: Charting the Path Towards Unified International Action and Resilience,Ed Koellner,Ed Koellner,regulating space cybersecurity charting the path towards unified international action and resilience,ed koellner
0361dcd8ff993bff97d84557d9ab7dea,Regulatory Risk and Independent Director Behavior: Evidence from China,Ning Hu,Ning Hu; Jing Ma; Shilei Yu; Zhiyuan Zhang,regulatory risk and independent director behavior evidence from china,ning hu
2f1f3fd85d8dda2221dfbe2899aa0274,Reimagining Competition Policy in the Age of Sustainability and AI,Walid Chaiehloudj,Walid Chaiehloudj,reimagining competition policy in the age of sustainability and ai,walid chaiehloudj
4250f8a0114ebbd957d724760b33cdcc,Relationship between Relationship between advertising and firm value: advertising and firm value: Evidence from Jordan Evidence from Jordan,Mohammad Fawzi Shubita,Mohammad Fawzi Shubita; Abdalwali Lutfi; Mohammed W.A. Saleh; Marwan Mansour,relationship between relationship between advertising and firm value advertising and firm value evidence from jordan evidence from jordan,mohammad shubita
ee8d1207bb14f9f156ca0036d8b0016f,Research on Dimensional Instability Control of Aluminum Alloy Thin-Walled Components Based on Droplet + Arc Additive Manufacturing,Xin Wang,Xin Wang; Xinxin Gao; Xin Wang; Bai Yin; Wang Shuxian,research on dimensional instability control of aluminum alloy thinwalled components based on droplet  arc additive manufacturing,xin wang
5dd5b7d4866fc67d7f3d1f6a6850cba9,"Residential Energy Communities: Balancing Stakeholder Financial Interests, Heat Decarbonisation and Grid Limitations",Ioanna Kalospyrou,Ioanna Kalospyrou; Timothy Hutty; Solomon Brown,residential energy communities balancing stakeholder financial interests heat decarbonisation and grid limitations,ioanna kalospyrou
a582974cef45828f3e9bc04b0292f2ca,Revenue Sharing and Intrinsic Upward Price Pressure from Vertical Mergers,Gopal Das Varma,Gopal Das Varma; Adriana de la Huerta; Martino De Stefano; Stakeholder,revenue sharing and intrinsic upward price pressure from vertical mergers,gopal varma
665a16290c68c161c143c37cc4e684dc,Revisiting  < Corporate <  Brand Name Changes: The Case of Nabisco in Japan as a Natural Experiment,Mitsuru Sunada,Mitsuru Sunada,revisiting   corporate   brand name changes the case of nabisco in japan as a natural experiment,mitsuru sunada
b2c78a3efda6f8067577b2226336b016,Revisiting the Bangladesh National Shipping Policy 2000: A Critical Review and Reform Roadmap,Obaid Bashir,Obaid Bashir,revisiting the bangladesh national shipping policy 2000 a critical review and reform roadmap,obaid bashir
02a1f5c19ceccb1226937144a2e7211d,Revisiting the Pollution Haven Hypothesis: Green Upgrading of Foreign Investment in Southern Host Countries Through Strategic Environmental Policies,Liming Hong,Liming Hong; Shuijun Peng; Sajid Anwar; Lili Yu,revisiting the pollution haven hypothesis green upgrading of foreign investment in southern host countries through strategic environmental policies,liming hong
c472522546f83686a45787cbb049dde8,Risky Banking: How Global Financial Cycle Drives Systemic Risk Through Non-Core Channels,Chiara Banti,Chiara Banti; Udichibarna Bose; Akhilesh K Verma; There are 2 versions of this paper,risky banking how global financial cycle drives systemic risk through noncore channels,chiara banti
