paper_id,title,first_author,authors,norm_title,norm_first_author
1bd6152d4e767168cec6de21fad80f0c,Robust Controllers for a Tethered Magnus-Effect Winged Quadcopter System: Experimental Validation Under Wind Disturbance,zakeye azaki,zakeye azaki; Jonathan Dumon; Nacim Meslem; Alexis Offermann; Pierre Susbielle; Amaury Negre; Ahmad Hably; Directors,robust controllers for a tethered magnuseffect winged quadcopter system experimental validation under wind disturbance,zakeye azaki
09453a6e0d48eb5960dbf982ffbaa56a,SOCIALLY RESPONSIBLE INVESTMENT IN INDIA: A CONCEPTUAL FRAMEWORK Poonam,Sandeep Aggarwal,Sandeep Aggarwal,socially responsible investment in india a conceptual framework poonam,sandeep aggarwal
838da136c5e792ea8077981631a5da58,Shadow Banking and Banking Landscape: Evidence from China,Zhanhao Wang,Zhanhao Wang; Xin Xie; Weina Yu,shadow banking and banking landscape evidence from china,zhanhao wang
1d41750d74e61484ee00609ecb940390,Signaling Through Security Design: Evidence from Commercial Mortgage-Backed Securities,Craig Furfine,Craig Furfine; Brandon Zborowski,signaling through security design evidence from commercial mortgagebacked securities,craig furfine
b73c1d33e04bdc19227c3e0d232b8e84,Silencing Salary Talk: How Salary History Bans Affect Corporate Investment and Performance,Matthew Serfling,Matthew Serfling; Wenxuan Sun,silencing salary talk how salary history bans affect corporate investment and performance,matthew serfling
bdfdd9b0e7eac480abb925ca69744c93,Slum Managers,Anika Singh Lemar,Anika Singh Lemar,slum managers,anika lemar
7e2c201fb9dce0a7ebab0f4037014b6e,Smart City Development: Analyzing the Feasibility of Smart Water Supply Systems in Qazvin,Mahmoud Taheri,Mahmoud Taheri; Navid Saeedi Rezvani; Ramadan Ali Shormij,smart city development analyzing the feasibility of smart water supply systems in qazvin,mahmoud taheri
f15bb2bc40763273b69370e06f257625,"Societal Perception, Socio-Economic Impacts and Management Challenges of an Invasive Nonindigenous Fish",Jonne Kotta,Jonne Kotta; Heli Einberg; Kristiina Nurkse; Kandela Õun; Henn Ojaveer,societal perception socioeconomic impacts and management challenges of an invasive nonindigenous fish,jonne kotta
6188dc72c5e30a9e22b7575ba4041db0,Stablecoins and safe asset prices,Iñaki Aldasoro,Iñaki Aldasoro; Rashad Ahmed,stablecoins and safe asset prices,inaki aldasoro
c427d3da72d84c4bce8c814a92ee1291,"Stories, Individuals, Statistics, Aggregation, Torts, and Social Justice: Deborah Hensler's Aspirations for Law",Judith Resnik,Judith Resnik,stories individuals statistics aggregation torts and social justice deborah henslers aspirations for law,judith resnik
a9db05e8bf8275dfa68cb0e5596ddf88,Strategic Allocation of Slack to Enhance Operational Performance: Evidence from the US Airline Industry,Chandrasekhar Manchiraju,Chandrasekhar Manchiraju; Ashutosh Bhave; Milind G. Sohoni,strategic allocation of slack to enhance operational performance evidence from the us airline industry,chandrasekhar manchiraju
94fcba7562698b6956aa78ac9395c863,Strategic Prioritization of Mining Policies in Colombia Through the Igor Hybrid Framework,Gloria Patricia Jaramillo,Gloria Patricia Jaramillo; Ricardo Smith; Linda Berrio-Giraldo; Olga Tatiana Araque-Mendoza; Carlos Correa-Florez; Santiago Arango-Aramburo,strategic prioritization of mining policies in colombia through the igor hybrid framework,gloria jaramillo
6bddb2305435c29277b09481dc67ea08,Strengthening Ethical Procurement Practices: Compliance And Challenges In Supply Management At Neust,Christopher Da Jose,Christopher Da Jose; Marc Daniel Santiago; Marjorie Manalo; Noel Agustin; Felipe E. Balaria,strengthening ethical procurement practices compliance and challenges in supply management at neust,christopher jose
cef188a0a0339204b937c555faba2427,Structural Inefficiencies in the U.S. Healthcare System,Aydin Teymourifar,Aydin Teymourifar,structural inefficiencies in the us healthcare system,aydin teymourifar
88502cdc40390d93dda56c3032de9183,Supporting Player Wellbeing and Building Sustainable Career Pathways in Esports,Hee Jung Hong,Hee Jung Hong; Guy Wilkinson; Corporate,supporting player wellbeing and building sustainable career pathways in esports,hee hong
57d22fbb07f7ace7ffc4b26c64b383b6,Sustainability Managers for a New Global Era,Robert Taylor,Robert Taylor; Compensation,sustainability managers for a new global era,robert taylor
e9de7f5e9c9d4edeafa3d11748516d02,Sustainability committee and eco-innovation: A global perspective,Asad Mashwani,Asad Mashwani; Rizwan Mushtaq; Delaware; Proxy Advisors,sustainability committee and ecoinnovation a global perspective,asad mashwani
8c30c880a0ff0be626a063b66a2e11ca,Sustainable Business Practices: A Conceptual Framework for Long-Term Growth,Mohammad Yusuf Saleh,Mohammad Yusuf Saleh; Hamdullah Azimi,sustainable business practices a conceptual framework for longterm growth,mohammad saleh
18f6750cc74b247b1155af2f0b2db571,THE IMPACT OF CSR ON ORGANIZATIONAL CULTURE AND EMPLOYEE ENGAGEMENT BEYOND PROFIT,Jyotirmoy Banerjee,Jyotirmoy Banerjee,the impact of csr on organizational culture and employee engagement beyond profit,jyotirmoy banerjee
b956f0d76c76dab905ff20d23381b984,The impact of ESG performances on analyst report readability: Evidence from China,Xuan Feng,Xuan Feng,the impact of esg performances on analyst report readability evidence from china,xuan feng
1f968bdffd48d4b0d7bd7d34f9768e59,The technological shift: how a fortune 500 company builds resilience through dynamic capabilities and transformation,Sari Nour,Sari Nour; Anna Arbussà,the technological shift how a fortune 500 company builds resilience through dynamic capabilities and transformation,sari nour
4974eecd2ddea6ac205db5fb8c4776ad,To Interact or Not? On the Benefits of Interacting with Unfavorable Analysts during Earnings Calls,Jared Flake,Jared Flake,to interact or not on the benefits of interacting with unfavorable analysts during earnings calls,jared flake
28be0df7c35748a874e9d2bdc2ff3ff9,Token-Based Platform Governance,Joseph Abadi,Joseph Abadi; Markus K. Brunnermeier,tokenbased platform governance,joseph abadi
b3a77e07d6b5644adc97098e72ff146f,Too Far Away? The Effect of Remote Management on  < Corporate <  Disclosure,Meng Li,Meng Li; Matthew Ma; Yue Ma; Jing Pan,too far away the effect of remote management on   corporate   disclosure,meng li
2ea507d4512488259fc50f0581d3b47f,Towards Effective Educational Governance: An Evaluation of Managerial Skills of Palawan State University Administrators,Maria Ching Sayang,Maria Ching Sayang; Merger,towards effective educational governance an evaluation of managerial skills of palawan state university administrators,maria sayang
32582ac7fd3e8975d6737c400c5575e2,Towards an effective merger control policy in a dynamic context *,François Jeanjean,François Jeanjean; Stephane Ciriani,towards an effective merger control policy in a dynamic context,francois jeanjean
2f71bedfb638e34d25e4ce3e74138e2d,Trading on Inter-firm Links: Hedge Fund Learning Networks and Public Information Advantage,Dora Horstman,Dora Horstman; Boone Bowles; Xiaan Zhou; Mutual Funds,trading on interfirm links hedge fund learning networks and public information advantage,dora horstman
a1440b9bbce51329e1b8e0df8894a40f,Transfer Pricing and Investment - How OECD Transfer Pricing Rules Affect Investment Decisions,Søren Bo Nielsen,Søren Bo Nielsen; Dirk Schindler; Guttorm Schjelderup; Institutional Investors,transfer pricing and investment  how oecd transfer pricing rules affect investment decisions,søren nielsen
e7ea01541621c964aad99527a3a96a68,Triple-Entry Accounting: Transcending the Double-Entry System,Oyovwe Akajagbor,Oyovwe Akajagbor; Ofuan Ilaboya,tripleentry accounting transcending the doubleentry system,oyovwe akajagbor
c0d79c10285b82c7a4eb53b202b3794c,Turning off the lights: Newspaper closures and corporate tax avoidance,Jana Boeckx,Jana Boeckx; Francesco Stradi; Kristof Struyfs,turning off the lights newspaper closures and corporate tax avoidance,jana boeckx
0df73aace531ad4a60d08db4a5a7c85c,UNDERSTANDING ESCROW IN INDIA,Shankar Suwan Kaushal,Shankar Suwan Kaushal,understanding escrow in india,shankar kaushal
b3119ca0f946ffe23d474bea781ef020,Underground democracy: safeguarding committee voting against autocratic influences,Christian Feige,Christian Feige,underground democracy safeguarding committee voting against autocratic influences,christian feige
b1535c23460d0f936c59ac88cd73d4ad,Unlocking Growth in Postcolonial Jurisdictions: Reforming Notarial Monopolies and Legal Formalism in Puerto Rico,Scott Brown,Scott Brown; Daniel Hall; ESG,unlocking growth in postcolonial jurisdictions reforming notarial monopolies and legal formalism in puerto rico,scott brown
54a5479af48f1aa73e6f34aad61ecaaa,"Unlocking Insights into Prolific: Research Implications, Participant Behavior and Motivations",Billur Aksoy,Billur Aksoy; Saggi Nevo,unlocking insights into prolific research implications participant behavior and motivations,billur aksoy
c5d5b801796107da2e7e93a1df3141a4,"Upscaling Residential Solar Rooftop in Uttar Pradesh: Review of Policy, Practices and Stakeholders Perspective, Identification of Challenges and Solutions",Ashish Tiwari,Ashish Tiwari; R.K. Mall; Maheswar Rupakheti; Directors; Stakeholder,upscaling residential solar rooftop in uttar pradesh review of policy practices and stakeholders perspective identification of challenges and solutions,ashish tiwari
f95fa07dfa9744e7b18eca9adca197f6,"Votes for Assets: Mafia, Elections and Misallocation of Confiscated Properties *",Giovanni Righetto,Giovanni Righetto; Alessio Carrozzo Magli; Antonio Schiavone,votes for assets mafia elections and misallocation of confiscated properties,giovanni righetto
79ac67018155c505cf961d4e5739f135,"Votes for Cash, Clout, and Control: The Capitalist Undercurrent Steering Indian Democracy through Electoral Bonds",Dhruv K S,Dhruv K S,votes for cash clout and control the capitalist undercurrent steering indian democracy through electoral bonds,dhruv s
840839ad664bbf3f7522375d9a699185,What is Responsible for Stock Volatility? Evidence from A-Share Market in China,Muzi FENG,Muzi FENG; Kaiqi Sun,what is responsible for stock volatility evidence from ashare market in china,muzi feng
677e83a976aea864a5733f4eccc5ea1f,"When Climate Regulations Step In, Do Lenders Step Back? Evidence from State Greenhouse Gas Emission Target Adoptions",Peter R. Demerjian,Peter R. Demerjian; You-il (Chris) Park; Bohyun Yang,when climate regulations step in do lenders step back evidence from state greenhouse gas emission target adoptions,peter demerjian
a793b55737ebba2dccebe45b1116477e,White Paper: How AI and Cloud Will Transform the Landscape of Enterprise Applications,Shailesh Deshpande,Shailesh Deshpande,white paper how ai and cloud will transform the landscape of enterprise applications,shailesh deshpande
11796a92fa132625970ef601bf51e3ca,Who “Controls” Where Work Shall Be Done? State-of-Practice in Post-Pandemic Remote Work Regulation,Darja Šmite,Darja Šmite; Nils Brede Moe; Maria Teresa Baldassarre; Fabio Calefato; Guilherme H. Travassos; Marcin Floryan; Marcos Kalinowski; Daniel Mendez; Graziela Basilio Pereira; Margaret-Anne Storey; Rafael Prikladnicki,who controls where work shall be done stateofpractice in postpandemic remote work regulation,darja smite
277ba3590b4cdb3cecdd8948d5c897c5,Who's Watching the Machines? IOSCO's Role in Regulating AI in Global Finance,Beny Saputra,Beny Saputra; Retno Kusniati,whos watching the machines ioscos role in regulating ai in global finance,beny saputra
0bd3fca50a6f66da1c859f79fc3b027e,Why do Publicly Listed Companies Appoint Board Observers?,Anup Basnet,Anup Basnet; Magnus Blomkvist; Anders Löflund; Etienne Redor,why do publicly listed companies appoint board observers,anup basnet
5dd98870382905f5c48e2e16ca0ba44a,"Winner-Takes-All:  < Corporate <  Tax Avoidance, Market Power, and Wealth Concentration in Advanced Capitalist Democracies",Oscar Barrera-Rodríguez,Oscar Barrera-Rodríguez; Lakshmi Menon; Rafael Quintero Godinez; Aidan Regan; Linus Zechlin,winnertakesall   corporate   tax avoidance market power and wealth concentration in advanced capitalist democracies,oscar barrera-rodriguez
7dd0f5b0a3942b2313505ec2bb3909d7,Winners vs. Losers: Momentum-based Strategies with Intertemporal Choice for ESG Portfolios,Ayush Jha,Ayush Jha; Abootaleb Shirvani; Ali M. Jaffri; Svetlozar T. Rachev; Frank J. Fabozzi,winners vs losers momentumbased strategies with intertemporal choice for esg portfolios,ayush jha
a13f2ffb587a202bc325de8764a5948c,Quantum-Enhanced AI Candlestick Imaging Model (QECIM): Expansion with Accelerated Forward and Backtesting Using New Qubits for Enhanced Predictive Analysis,Mouhamad Abushaqra,Mouhamad Abushaqra; ESG,quantumenhanced ai candlestick imaging model qecim expansion with accelerated forward and backtesting using new qubits for enhanced predictive analysis,mouhamad abushaqra
6f53da221bf9a3e2cf4b3304e8619860,Putting US Fiscal Policy on a Sustainable Path,Karen E. Dynan,Karen E. Dynan; Douglas W. Elmendorf,putting us fiscal policy on a sustainable path,karen dynan
23850c03c7e4d9f9a172c573870c1279,Quality Management Process of the 7 Habits of Students in Sarasas Affiliated Schools,Boosayachart Choejaroean,Boosayachart Choejaroean; Teerapon Kongnawang,quality management process of the 7 habits of students in sarasas affiliated schools,boosayachart choejaroean
94d331434b3e580c20dbf41350664de5,Public-Private Partnerships: A Comparative Study between Japan and India: A Review,Benny Sally,Benny Sally,publicprivate partnerships a comparative study between japan and india a review,benny sally
e06501573eefdc0e3d3f066eff09b49c,Privacy & Antitrust Reform: How to Avoid the Starfish Problem,Abbey Stemler,Abbey Stemler,privacy  antitrust reform how to avoid the starfish problem,abbey stemler
baeb5fc9b44f78c6e3e3e8e3ee6c2147,Precedent Terms,Vincent S.J. Buccola,Vincent S.J. Buccola; David A. Hoffman,precedent terms,vincent buccola
fc49f86ce6ab91aaf5912ceacbcbdd00,Pre-Trade Transparency in Opaque Dealer Markets,Xiaolu Hu,Xiaolu Hu; Shyam Venkatesan; Yvonne Fang,pretrade transparency in opaque dealer markets,xiaolu hu
4595a9aa9c00f2bf8292af630beca7c9,Portfolio Dynamics and the Supply of Safe  < Securities,David X Xu,David X Xu,portfolio dynamics and the supply of safe   securities,david xu
98ceb5f010ffa6ec80ed6b7267694d91,Population Aging and Labor Cost Management < — < A Machine-learning Approach,Ruirui Fang,Ruirui Fang; Nan Hu; Rong Huang; Haonan Wang,population aging and labor cost management    a machinelearning approach,ruirui fang
62529973aa8fe7da7a4e5df2317ba9f7,Political Research of the Foreign Policy Concept of the Islamic Republic of Iran,Subhan Talibli,Subhan Talibli,political research of the foreign policy concept of the islamic republic of iran,subhan talibli
416cef9e80fe0468acc88379e1a4c0df,Perceptions of Bank Employees Towards Green Finance: A Case Study,Dr. Prakash Chokkamreddy,Dr. Prakash Chokkamreddy; Vineela Kanthi,perceptions of bank employees towards green finance a case study,dr. chokkamreddy
f99a459284e14a1ef3d01a52df3108ca,Parliament got it right: Why structural presumptions make sense in  < merger <  review,Matthew Chiasson,Matthew Chiasson,parliament got it right why structural presumptions make sense in   merger   review,matthew chiasson
c131aab5bc1cc4ac09f3e7cb7be3dbd6,ParkWise: Locate and Avoid,Swanand Pasalkar,Swanand Pasalkar; Sanskruti Shingate; Pratibha Shelke; Pruthviraj Todkar; Shubham Wagh,parkwise locate and avoid,swanand pasalkar
735d6d11be689c8d67f5210cb6821111,Parental Leave from the Firm's Perspective,Gozde Corekcioglu,Gozde Corekcioglu; Marco Francesconi; Astrid Kunze,parental leave from the firms perspective,gozde corekcioglu
e3ed3d3f2d13c2f91021cf86fd90544e,Ordinary Ethics in the Age of AI,Margarita Boenig-Liptsin,Margarita Boenig-Liptsin,ordinary ethics in the age of ai,margarita boenig-liptsin
7535980edd5bb539d7ce506910d95600,Optimizing Tax Preparation and Filing Services: A Comparative Study of Traditional Methods and AI Augmented Tax Compliance Frameworks,Srinivas Kalisetty,Srinivas Kalisetty; Jeevani Singireddy,optimizing tax preparation and filing services a comparative study of traditional methods and ai augmented tax compliance frameworks,srinivas kalisetty
2a7d5e72685244d84ab1556e597be592,Optimal Non-swing Trading,Jing Xu,Jing Xu; Peiquan Yang; Compensation,optimal nonswing trading,jing xu
77087465119c0ddd5bf07ed675b93707,Ongoing Challenges to U.S. Climate-related Disclosure,Thomas M. Madden,Thomas M. Madden; Gerlinde Berger-Walliser,ongoing challenges to us climaterelated disclosure,thomas madden
9103fc3db05844f4b52ec0b8c56fb2f2,OECD REVIEW OF THE CORPORATE GOVERNANCE OF STATE-OWNED ENTERPRISES IN THAILAND: LESSON FOR PAKISTAN,Qaiser Rafique Yasser,Qaiser Rafique Yasser,oecd review of the corporate governance of stateowned enterprises in thailand lesson for pakistan,qaiser yasser
b5e2ca46b53da2712ffb7538cb5a002d,OECD REVIEW OF THE  < CORPORATE <  GOVERNANCE OF STATE-OWNED ENTERPRISES IN THAILAND: LESSON FOR PAKISTAN,Qaiser Rafique Yasser,Qaiser Rafique Yasser,oecd review of the   corporate   governance of stateowned enterprises in thailand lesson for pakistan,qaiser yasser
0206a2a15710beb30fb09147de3acd69,,Nicolin Decker,Nicolin Decker,,nicolin decker
0fa4d40865e356ed0902f73240c7996a,,Ruth Mason,Ruth Mason; Stephen Daly,,ruth mason
7cbd1ab4d2d88128e51ff08fad3a08fa,,Sanjay Bhayani,Sanjay Bhayani,,sanjay bhayani
01609f3926fc9332748a253c3505d14c,,Teddy Nakanwagi,Teddy Nakanwagi,,teddy nakanwagi
1e953d08eabb9cce674c11763bf6b0d9,,Robert Joy,Robert Joy,,robert joy
3abca6b21dcda507565b28ad0f196409,,Giovanni Bruno,Giovanni Bruno; Felix Goltz; Antoine Naly,,giovanni bruno
da711e0309921682cfac6c3a8c4700dc,,Michael Bogdan,Michael Bogdan; Daniel Schrass; Hedge Funds,,michael bogdan
18b5232c9ff9307f97abe4843f7b65c2,"401(k) Plan Asset Allocation, Account Balances, and Loan Activity in 2022",Sarah Holden,Sarah Holden; Steven Bass; Craig Copeland,401k plan asset allocation account balances and loan activity in 2022,sarah holden
dffc4cf19292085958b3d177e3dac28c,A STUDY OF FIRM CHARACTERISTICS AND CORPORATE DISCLOSURE: AN EMPIRICAL ANALYSIS,Sanjay Bhayani,Sanjay Bhayani,a study of firm characteristics and corporate disclosure an empirical analysis,sanjay bhayani
652481be2f7677fd06daa7d73c7b443f,A note on the equity market response to monetary shocks: Term premia vs. compensation for dividend risk,Dejanir Silva,Dejanir Silva; Nicolas Caramp,a note on the equity market response to monetary shocks term premia vs compensation for dividend risk,dejanir silva
1b617916f37d321e0deab9dd1458d5d2,AN EMPIRICAL ANALYSIS OF ECONOMIC VALUE ADDED OF INDIAN CORPORATE,Sanjay Bhayani,Sanjay Bhayani,an empirical analysis of economic value added of indian corporate,sanjay bhayani
bd07da87f8b52d80c98a79a1c5de25e8,Applications of Multimodal Large Language Models in Construction Industry,Abdolmajid Erfani,Abdolmajid Erfani; Ali Mansouri,applications of multimodal large language models in construction industry,abdolmajid erfani
38405394394306a27435b532d3fda4fa,Artificial Intelligence and unintended bias: A call for responsible innovation,Dhruvitkumar Talati,Dhruvitkumar Talati,artificial intelligence and unintended bias a call for responsible innovation,dhruvitkumar talati
040bc62142c27077588250dbc7816ec5,Banking on Jarkesy,Todd Phillips,Todd Phillips; Jacob Cunningham,banking on jarkesy,todd phillips
cef94310f79e13e15d28e459174453cd,Benefiting from Structural Ambidexterity Through Business Model Innovation at a Fintech Corporate Startup Studio,Joaqun Alegre,Joaqun Alegre; Carole Donada; Gwenaelle Nogatchewsky; Institutional Investors,benefiting from structural ambidexterity through business model innovation at a fintech corporate startup studio,joaqun alegre
fd4ededfdf0626822047d6b2d406481c,Biodiversity Risks and Global Lending: Balancing Corporate Effort and Country Governance,Marta Degl'Innocenti,Marta Degl'Innocenti; Marta Degl'Innocenti; Lorenzo Gai; Si Zhou; Yue Zhou,biodiversity risks and global lending balancing corporate effort and country governance,marta degl'innocenti
92fe215116bab6005095a5155e0d9b53,Building Trust in AI: Leadership Insights from Malaysian Fintech Boards,Alex Zarifis,Alex Zarifis; Larisa Yarovaya,building trust in ai leadership insights from malaysian fintech boards,alex zarifis
76268a8ab8a306fc89541268578aae49,CLEARfund: A National Compliance Utility for the Digital Economy,Nicolin Decker,Nicolin Decker; Shareholder,clearfund a national compliance utility for the digital economy,nicolin decker
8fc76056f675a08ab518feb6e814a794,"Characteristics of Mutual Fund Investors, 2024",Sarah Holden,Sarah Holden; Daniel Schrass; Michael Bogdan,characteristics of mutual fund investors 2024,sarah holden
f44ae10312ed38e089465436b16c74fe,Collusion Through Common Leadership,Alejandro Herrera-Caicedo,Alejandro Herrera-Caicedo; Jessica Jeffers; Elena Prager; Merger,collusion through common leadership,alejandro herrera-caicedo
9bb07e73ff6d4dbb3a535290f776cf03,Community Engagement Strategies for Promoting Road Safety Awareness and Supporting SEL Initiatives in Underserved Communities Authors,Ada John,Ada John; Asher Asher,community engagement strategies for promoting road safety awareness and supporting sel initiatives in underserved communities authors,ada john
5babfd7329a49c0a4aa4cc3efe9504a8,Contract Strategy and Compliance in Cross-Border Procurement: Legal Frameworks and Challenges in UAE-CIS Business Operations,Nigar Valiyeva,Nigar Valiyeva,contract strategy and compliance in crossborder procurement legal frameworks and challenges in uaecis business operations,nigar valiyeva
8bfd090d26d9595617f9e873eebdbce0,Coordinated Pricing After a Blocked Merger: Evidence from the JetBlue-Spirit Case,Minhae Kim,Minhae Kim; Myongjin Kim; Junyeol Ryu,coordinated pricing after a blocked merger evidence from the jetbluespirit case,minhae kim
01fb9beeb8e396d4dca9ea908303a195,Corporate Culture and Bank Financial Performance: A Case Study of the Wells Fargo Sales Practices Scandal,James E. McNulty,James E. McNulty; Aigbe Akhigbe; Compensation,corporate culture and bank financial performance a case study of the wells fargo sales practices scandal,james mcnulty
79e17046f8d0d867400b351334e488f3,Corporate Financing and Endogenous Dispersion and Volatility in Stock Returns,Wukuang Cun,Wukuang Cun; Junjie Xia,corporate financing and endogenous dispersion and volatility in stock returns,wukuang cun
0121297f17077800b93376b3eeab79c0,Corporate Moral Rights,Amy J. Sepinwall,Amy J. Sepinwall,corporate moral rights,amy sepinwall
0b89580ac6d1096874ade151ecc8bb43,Debt Maturity and Greenwashing: An Inverted U-Shaped Dilemma,Paula Castro,Paula Castro; Cristina Gutirrez-Lpez,debt maturity and greenwashing an inverted ushaped dilemma,paula castro
bb1bb407e490a50a6b5258234f2c6328,Developing End-to-End Intelligent Finance Solutions Through AI and Cloud Integration,Murali Malempati,Murali Malempati,developing endtoend intelligent finance solutions through ai and cloud integration,murali malempati
527e7d576b7ba184ae73bfc3b53dcde4,Developing Multi-Risk Drm Pathways  Lessons from Four European Case Studies,Julius Schlumberger,Julius Schlumberger; Andrew Warren; Anne Sophie Daloz; David Geurts; Stefan Hochrainer; Lin Ma; Noem Padrn-Fumero; Karina Reiter; Robert Sakic Trogrlic; Sharon Tatman; Vanessa J. Banks; J Crummy; Jaime Daz-Pacheco; Pedro Dorta Antequera; Sara Garca-Gonzlez; Abel Lpez-Dez; Tamara Luca Febles Arvalo; David Romero-Manrique; Nikita Strelkovskii; Silvia Torresan; Asbjorn Torvanger; Veronica Casartelli; Roxana Ciurean; Judith N. Claassen; Stefania Gottardo; J.C.J.H. Aerts; Marjolijn Haasnoot; Marleen de Ruiter,developing multirisk drm pathways  lessons from four european case studies,julius schlumberger
fb8780a5b93765611537a49a55eef204,Drivers of exchange sustainability development: Evidence from a decade of surveys,Kaitao Lin,Kaitao Lin; Ying Liu,drivers of exchange sustainability development evidence from a decade of surveys,kaitao lin
891fbcc2d1be94ba0863357d3a2a2441,ESG Mania and Institutional Trading,Riza Demirer,Riza Demirer; Lavinia Rognone; Huacheng Zhang,esg mania and institutional trading,riza demirer
add3b7f2e8c8071cfd0c14af556dac02,ESG and Capital Investment in BRICS Countries,Quang-Hung Phung,Quang-Hung Phung; Nguyen-Quynh-Nhu Ngo,esg and capital investment in brics countries,quang-hung phung
1612d0f676977574eb0d95e99d4187d1,Educare International Journal of Commerce and Management,Sanjay Bhayani,Sanjay Bhayani,educare international journal of commerce and management,sanjay bhayani
3618c54286a948bcc95544f9bd08af8f,Education as an Informational Edge: How Foreign Education Shapes Fund Managers' Equity Selection and Performance,Zheyuan (Kevin) Cui,Zheyuan (Kevin) Cui; Yinan Qiu,education as an informational edge how foreign education shapes fund managers equity selection and performance,zheyuan cui
17fa4a3f7a90b5c41b3ed471ca2c0662,Enhancing Employee Cybersecurity Awareness in Small Businesses,ABINET ONKISO,ABINET ONKISO,enhancing employee cybersecurity awareness in small businesses,abinet onkiso
342244576a49e9b995d11131f420bd18,Factions of Asset-Based Capitalism: A Historical Typology,Cooper Melinda,Cooper Melinda; ESG,factions of assetbased capitalism a historical typology,cooper melinda
82200950fdca4c510065dbc41d0b820f,Financial Reporting for the Knowledge Economy,Anup Srivastava,Anup Srivastava,financial reporting for the knowledge economy,anup srivastava
